Product ID,Product Name,Price
c5-portable-tire-inflator,C5 Portable Tire Inflator,59.99
c7-portable-tire-inflator,C7 Portable Tire Inflator,69.99
rehottop-compressed-air-duster-250000rpm-electric-air-duster-with-brushless-motor-jet-dry-blower-replace-air-can-no-canned-air-duster-air-blower-for-computer-keyboard-house,REHOTTOP Compressed Air Duster,59.99
rehottop-cordless-tire-inflator-portable-air-compressor-180psi-12v-dc-air-pump-for-car-with-auto-shutoff-led-light-tire-pump-for-cars-bicycle-motorcycles,REHOTTOP Cordless Tire Inflator 180PSI,59.99
rehottop-electric-ball-pump-portable-air-pump-with-pressure-gauge-and-digital-lcd-display,REHOTTOP Electric Ball Pump,49.99
rehottop-electric-bike-pump-4x-fast-bicycle-pump-with-digital-pressure-gauge-bike-air-pump-with-presta-valve-for-e-bike-car-road-bicycle-and-balls-c3,REHOTTOP Electric Bike Pump C3,53.99
rehottop-jump-starter-2000a-car-battery-jump-starter-for-up-to-9-0l-gas-or-7-5l-diesel-engines,REHOTTOP Jump Starter 2000A,79.99
rehottop-jump-starter-s3000-car-battery-jump-starter-for-up-to-9-0l-gas-or-7-5l-diesel-engines,REHOTTOP Jump Starter S3000,89.99
rehottop-portable-car-vacuum-cleaner-handheld-vacuum-cleaner,REHOTTOP Portable Car Vacuum Cleaner,49.99
rehottop-portable-tire-inflator-a17,REHOTTOP Portable Tire Inflator A17,69.99
rehottop-portable-tire-inflator-suitable-for-bicycles-and-motorcycles-160-psi,REHOTTOP Portable Tire Inflator 160PSI,53.98
rehottop-rs5-car-jump-starter-tire-inflator-2-in-1,REHOTTOP RS5 Car Jump Starter 2-in-1,109.99
